"X1","X2","X3"
"No.38 :","お試しで安いから買ってみたけど、思ったよりも良い感じ。ただ、アプリで映画やアニメをみる人は不満があるかも…音が悪いwwイヤホンにしたら問題なしw後、若干だけど音声と画像がずれるから違和感がある。何か設定すれば直るのか？？うーん…わからんwゲームは少しロードが遅い様に感じるけど、そこまでゲームに拘ってるわけじゃないからいいやww 問題なしw",5
"No.39 :","まず付属品の充電のACが入っていなかった。なんとなくwi-fiの感度が低い気がします。部屋で動画見たりするようなので我慢できますが・・・室内のwi-fiの感度が怪しい方はやめた方が良いかもしれません。",3
"No.40 :","私はYouTube、Amazonプライムビデオといった動画視聴をメインで使っておりますが、画質、音質共に不満はありません。操作性は少しもっさりしています。私は普段iPhoneを使っていますが、それに比べてるともっさり感が否めません。これが嫌な方はもう少しお金を出して質の良いタブレットを買うことをお勧めします。バッテリーについては2、3時間使う程度なら問題ありません。値段が1万円と安価ですし私のように動画を見るだけで画質等にこだわりがない方は充分満足できます。",5
"No.41 :","ゲームはほぼインストールすら出来ません。YouTubeとネット検索程度なら問題ありません。予想通りでしたが少し残念です。",1
"No.42 :","購入して3日間使用した感想です。電池のヘリが早いです。動画を2時間ぐらい見て1日ギリギリ持つ感じです。何もしていなくても減少が早い気がします。画面のきれいさや、動きはスムーズとは言えないですが、許容範囲です。スピーカーからの音も普通です。（私は外部スピーカを使用していますが。）この価格としてはよくできていると思います。後は、どのくらい順調に動いてくれるかです。",4
"No.43 :","バッテリー、使わなくてもどんどん減るので毎日充電しています。価格的にはお手頃だし、Kindle利用のための購入でしたので使い勝手はとてもいいです。",3
"No.44 :","初期のiPadを使ってましたが、アプリ更新も出来なくなり　安価なもので探して購入手にした時は価格相応と感じましたが、自分が必要とする機能は十分でした。自分に不要な機能で重くなるのが嫌でしたが、機能や重量がこの価格で購入できて満足。Blu-rayリンクで朝ドラも外見れてます。",5
"No.45 :","音楽をストリーミングで流す用に購入。Wi-Fiが電波2.４GHzしかなく当方の設置場所はルーターから4mほどで速度1Mbps以下、音楽聴くのは問題なく使えますが、動画は厳しいです。ルーター1m以内に行くと10Mbpsほどになります。ちなみに同じルーターに5GHz帯で接続してるiPad、iPhoneは速度100～200Mbps出てます。画質悪く無いですが、動作は重い時が結構ありますが用途的には満足しています。",3
"No.46 :","ディスプレイの色が若干悪い、設定で変更しても上手く行きませんでした、それと充電中を知らせる灯火がないので、いちいちスイッチを操作して確認しています。その他は問題はありません自身が望むアプリは全て設定しました、要は使い慣れれば良いタブレットとなるでしょう。",4
"No.47 :","息子の野球ゲームアプリが出来ればと思い購入しましたが、反応が遅すぎてゲームになりませんでした。レビューを参考にして購入したつもりですが、YouTubeやTikTokなども遅いです。使っていなくても、時間が経てば充電は1日待たずに切れます。SNOWをやってみたら、縦画面にしたいのに、なぜかカメラが下じゃないと縦画面にならない。SNOWのフィルターが反応せず、結局アンインストール。小学校低学年までの子供が使うゲームアプリだと、まだ使えます。それ以上の子が使うような高度なアプリはやはり無理でした。でも、下の娘はとりあえず満足しているので、星は3です。",3
"No.48 :","主に動画を見たくて買いました。アプリの立ち上げはかなり遅いです。スマホでの早さに慣れていると余計に遅く感じます。それから画面の明るさが強烈なので目を傷めそうです。1番暗くしてもそれなりの明るさなので注意が必要ですね。私のやつだけかもしれないけど、充電器の差し込み口が歪んでいるのか差し込むのにコツがいりました。無理にはめようとすると部品を壊しそうでいつも不安。このタブレットは自信を持ってオススメは出来ないです。",3
"No.49 :","注文して、翌日届きました。スマホの大きい版で、設定や使用も簡単でした。職場でiPad使用していて、欲しいなぁとは思ってたのですが、なかなか手が出ずでした。検索してみるとピンからキリまであって迷いましたが、初回購入でこの低価格なら手を出せる！と思い購入しました。買って良かったです。基本動画を観るのに使いますが、使いこなせたら新しいことに挑戦してみたいです。",4
"No.50 :","約2ヶ月で電源落ちて充電しても電源立ち上がりません不良品です買って損しました",1
"No.51 :","すぐに液晶が割れてだめになってしまった。買わないほうがいいのでは。",1
"No.52 :","初めてのタブレット購入なので、使用感などは他の機種との比較は出来ないのですが、使用しているスマホがAndroidなので、使い初めも面倒な作業はほとんど無く、すぐにサクサクと使うことが出来ました。息子が言うにはiPadに比べたら動きが遅いらしいですが、動画やYouTubeを楽しむには充分です。価格も手頃だし、初心者には満足でした。",4
"No.53 :","2ヶ月使ってみました。画質もバッテリーも満足してます。前回使ってたタブレットが7年以上使ってたのでこの安さでタブレット買えて満足です。ゲームはしてないので分かりません。動画用なので、アムプラとかの動画アプリ使ってますが、反映が遅いです。そして外に持ち歩くには重いです。",4
"No.54 :","自宅のパソコンが急に起動しなくなったので（結局、修理が必要なことが判明）、とりあえず代わりになればと以前から気になってたタブレットで最新機種のこの機種を購入しました。アンドロイドのスマホを使用してる方なら操作の開始は全く問題なし。さらにはこんなちっぽけなタブレットでも、ほとんど問題なくパソコンと同様な操作ができて本当にビックリです。1万円ちょっとで、このパフォ－マンス。すごく満足してます。",5
"No.55 :","今は動画配信が充実しているので、様々な自己練習、勉強やレッスン、料理など自身やお子さんの為に利用するには十分です。少しアプリの起動に遅さを感じますがさほど気にはならないです。ピアノの練習用に画面の大きなタブレットが欲しかったので購入しました。",4
"No.56 :","注文の翌日に到着し、梱包もダンボール箱にクッション材が入れてあり、破損などなく問題ありませんでした。商品は箱から取り出し電源 ボタンを押して直ぐに立ち上がり、設定も日本語表記でWi-Fi接続、メール接続等簡単に完了しました。",4
"No.57 :","幼稚園児の子供が動画を見たり学習用に購入致しました。以前はarrowsのタブレットを使っておりまして、それに比べると少しだけ重いですが問題ありません。機械が苦手な私にも最初の設定などスムーズに行う事が出来ました。操作も簡単なので子供が自分で操作してます。私も、テレビがない場所でタブレットを使って動画を見ておりますが見やすいです。この値段でこのクオリティ、音や映像も問題ありません。買ってよかったです。",5
"No.58 :","ウィジェットに対応していないため即日返品しました。今どきウィジェット不可のタブレットって...。",1
"No.59 :","操作しやすい。きちんと日本語表記です(^O^)子供のゲーム用に購入しました。安いので期待はしていませんでしたが操作もしやすいようです。専用ケースもいただけるとのことで、とてもいい買い物になったとおもいます。もちが良ければ姉妹用にまた購入考えます(^○^)",4
"No.60 :","iPadも持っていますが、別に資料データ用に購入。動作速度や画質はiPadには劣りますが資料を見る分には全く遜色なし。コストパフォーマンスは満足出来るレベルです。今後は使いながらバッテリーも確認します。買って損はない商品かと思います。",5
"No.61 :","娘が頼んで注文したので評価が分からない。ので星一つです。許してください。",1
"No.62 :","大変満足していますタブレットに求めるのはインターネット検索、YouTube 程度なんですがストレスなく使用出来ますね。なにより価格が安いのに求めたパフォーマンスが可能なので大変満足！さらに画面保護シールが初めから貼られているので別途購入は不要な点もgoodおすすめです！",5
"No.63 :","新しいのに反応がそこまで良いとは感じなかった。背面が傷がつきやすい。開けたばかりなのにすぐに傷がついた。クックパッドがタブレット表示にならないのが残念。レシピと材料が別のスクロールになる方が見やすい。前使っていたのd-tabがそのような仕様だったのか…？YouTube見る分にはいいのかもしれない。そのまま子供用になりそう。お値段相応な感じ。お値段以上ではない。",3
"No.64 :","購入しておよそ3か月。電源投入後、画面上に倒れたドロイドくんが現れ「コマンドが指定されていません」と表示。他社製品ではネット上にレスキュー方法が書いてあるものの、COOPERSについては一件もなし。Amazonから問合せしたもののなしのつぶて。安物買いの銭失いでした。",1
"No.65 :","子どもの誕生日プレゼントで購入しました。家ではWi-Fi環境がないため、携帯テザリングで使用する為、購入しました。設定も問題なく、すんなり出来、YouTubeはストレスなく見ることができました。Android10で、この値段はお得です。一つ残念なのは、画面の保護シールの角が、折れていました。",4
"No.66 :","子供が前のタブレットを破壊したのでこれを。高いのはまたやられるので安価で済ませました。だが、軽くて綺麗。サクサク動き音も大きくなる。たまに固まるがネットワークのせいかな。",5
"No.67 :","ゲー厶はしないので評価はできませんが、YouTubeは途切れなく、問題無く見ることができ満足しています。本体購入後カバーを買いましたが、本体とカバーは同時購入をおすすめします。処理速度はひょっとしたら遅いかもしれませんが、そのつもりで使えば問題ありません。(うちのwifiが遅いのが原因かもしれません)",5
"No.68 :","メディアを読み込めませんでした。                        <U+00A0>初期化しても画面が勝手にタッチされるようになり使えません",1
"No.69 :","総合的に良い、良い買い物でした。画面が綺麗、画面の大きさ、動作はまあまあ、バッテリーの容量それなりの持続時間、難しい設定とかしなくても良いしPlayストアが使える、お手頃価格、と言った所です。高齢の母親がメイン使用であることから、このスペックで十分活躍しています。",5
"No.70 :","画面が大きくて使いやすいです！！タップしてからの反応も早いのでいい感じ(*ﾟ▽ﾟ*)海外で使ってますがサクサク動いて最高です！重さも個人的には気にならないです！！とても軽い方だと思います！！画質も綺麗で嬉しいです♪注文してから発送されるまでわずか５日！！（海外在住）めちゃめちゃ早くて驚きました！ありがとうございます♪( '▽｀)",5
"No.71 :","届いて電源ボタンを押したら、バッテリー92％の表示が出て消えてしまいました。長押ししても真っ暗のままで、結局、リセットをおして起動しました。漫画や小説をスマホで読むのが老眼でつらくなってきたので、お手頃のものを探していたので、その面では満足です。うちにある同じサイズのiPadより少し重いです。動画の起動は遅いです。バッテリーの持ちは良いと思います。",4
"No.72 :","ハズレを引いたようですリセットをかけても、全く反応無し中国製は、当たり、ハズレが多々あります返品期限内に結果が出たのが幸いでしたが購入を検討されている方は、気をつけて下さい",1
"No.73 :","このお値段だったら文句ありません。画質もきれいだし、重さも問題ない。あれこれ探してこれに決めて、正解だったと思います。使用はYouTubeなどの動画を見たり、検索したりなので、足りないことはないです。画面の保護シートもついていたのが、ポイントアップでした。",5
"No.74 :","普段はiPadを使っていますが、子供用にこちらを購入しました。使い方が少し違うので慣れるのに時間がかかると思いますが、大きな画面で見やすいです。細かい機能まではわかりませんが、基本的なことはすぐにできます。購入して良かったと思います！",4
"No.75 :","最初に注文したものはLEDの横ラインごとドット抜けしていたので返品し再度購入しました。ほぼYou Tubeを見るために利用しています。起動がやや遅いです。まだ使い始めですが最終的には耐久性で評価されると思います。",3
"No.76 :","画面がとてもキレイですタッチパネルの反応もよく設定なども普通に行えました大変満足しました",5
"No.77 :","購入後１ヶ月、ネット利用中に、キューっと大きな音が生じ、どのボタンを押しても反応無く、充電が切れるまで大きな音がしたまま、朝になり充電が切れました。返品しました。",1
"No.78 :","自宅での動画視聴を目的に購入しました。タブレットは初めてでしたがネットサーフィンや動画の視聴をしてみて画質は十分に綺麗で操作性も良いので非常に満足です。他のタブレットに比べて軽いのでどこでも持ち運べます。使いやすくて大満足です。",5
"No.79 :","梱包も問題なく届きました。設定も簡単にできました。この値段でとてもいい買い物ができたと思います。バッテリーはまだ使用したばかりで分かりませんがとりあえずは問題ありません。",5
"No.80 :","今回は、子供のYouTube閲覧やアプリ使用のために２台購入。まだ１台しか使っていませんが、今のところ普通にサクサク使えています。しばらく使ってみないとわからないところもありますが、落としたりしてすぐに壊してしまいがちな子供には、お値段もクウォリティもいいのではないでしょうか。",4
"No.81 :","YouTubeの再生、1080pの動画だとカクつきます。Bluetoothでスピーカーに接続すると遅延もすごいです。壊れたらまた買うかと聞かれたら答えはNOです。ただ普通に使えます。それが良さです。",3
"No.82 :","検索できずYouTubeは見れるけど他の動画は検索してもエラーYouTubeだけ",2
"No.83 :","注文して、翌日届きました。設定や使用も簡単でした。YouTubeやゲームするのに、欲しいなぁとは思ってたのですが、なかなか手が出ずでした。検索してみるとピ初回購入でこの低価格なら手を出せる！と思い購入しました。買って良かったです。基本動画を観るのに使いますが、使いこなせたら新しいことに挑戦してみたいです。",4
"No.84 :","電子書籍をスマホで読むことに限界を感じ、こちらのタブレットを購入しました。動画も再生してみたところ、思いのほかスムーズに動いたので目的の電子書籍以外にも色々なことに使えそうです。多少動作にもたつきはありますが、値段を考えれは充分かと。自宅のみでの使用になるので、重さも特に気になりませんでした。",4
"No.85 :","バッテリーもすぐ切れ、充電に時間がかかる。Wi-Fiすぐに途切れる。安かろう悪かろうの商品だった、、。買わなければよかった。",1
"No.86 :","1万円のタブレットなので、カメラやネットなどの簡単な機能が使えればいいかなと思っていたが、それすらも重くて使えない。ただのゴミ。",2
"No.87 :","高齢の家族のゲーム用に購入して満足しています。軽くて使い易いし、なにより値段が安いのが一番嬉しい。",5
"No.88 :","雑誌の読書用に購入しました。画質に問題ありません。スピーカーはイマイチです。1日がっつり使うとバッテリーが少し心配ですが許容範囲だと思います。購入して1週間もたっていませんが今のところ満足しています。",4
"No.89 :","お値段のわりに使いやすい商品です。小説を読むために購入したので、文字だけならスマホより見やすいです。画質は少し粗めですがお値段を考えれば充分です。ただ、同封の説明書の一部が実際の画面にでてこなくて残念です。無いと困る程の機能ではないので諦めました。それでも、分かりやすく使い勝手のよい商品だとおもいます。",5
"No.90 :","不良品なのかも知れないと思うほど、レスポンスが悪い。画質も音も悪く常にストレスがかかります。ゲームもモンスト程度でもカクついて遊べません。安物買いの銭失いでしたね。絶対買わないほうがいいと思います。",2
"No.91 :","今まで使用していたタブレットが壊れてしまったので急遽購入しました。子供がYouTube見る為のタブレットなのでこちらの商品で充分楽しめます。子供が操作しているのを見ているとすんなり動いているので色々と操作したい方でなければ充分な商品だと思います。",5
"No.92 :","サイズも程よく裏面はマットなゴムみたいなコーティングがされていました。性能は価格が表しているかな、YouTubeは（1080Pの60ｐ）にするとロードに時間が取られるし決して高性能ではないです。それをわかって買う分にはいいと思う。パソコン作業の傍らに使いたいので買いましたが、結構気に入ってます。",4
"No.93 :","母が以前使用していたタブレットが壊れ、買い替え品として購入。主に、YoutubeやAmeba TVでの動画鑑賞用。操作がわかりやすく、画質がキレイととても喜んでます。手頃なお値段にもとても満足しています",5
"No.94 :","内室アプリで使ってますが、読み込みにちょっと時間がかかります。バッテリーの減りが、ちょっと早い感じです。電源の本体側端子部は、丁寧に扱わないと、すぐ、破損してしまう感じです。",3
"No.95 :","動画視聴用にと思い初めてタブレットを購入しました。すんなり設定が終わり、動画視聴も問題なくつかえています。アプリの立ち上がりが、遅いですが、安いから仕方ないかなと思っています。指紋が目立つので、フィルターも同時に購入しておけばよかったです。総体的に今のところは満足してます。",3
"No.96 :","入院中の家族のビデオ通話のために購入。あとは動画視聴に使うぐらいです。画像はお世辞にもキレイとは言えませんが見えにくいとは思わないので普通に使えますイヤホンジャックがあるのもポイント高い。買ってすぐに使う予定だったので、初期の設定が楽だったのもよかったです。",4
"No.97 :","カメラの画質はこの程度かなと思うレベルで、大きな不満はありません。youtubeを見る程度では1日利用してもバッテリーは大丈夫でした。1か月程利用した所で片側長辺の画面のタッチが反応しなくなりました。画面を回転させれば操作に問題は無いですが、ゲーム利用する場合は注意が必要です。",3
"No.98 :","Wi-Fiにつながるまで半日かかりました。諦めかけていたとき、「パスワード」欄に「パスワード」でなく「暗号化キー」を入力したところ、つながりました。ちなみにルーターはBuffalo製です。説明がもう少していねいであったらよかったのにと思います。画面は予想以上にきれいなのですが、ネット検索がやや遅いのが気になります。",4
"No.99 :","2ヶ月ほど使って ゲームアプリとか かなり 入れましたけど いきなり中国語の ホーム画面になり 全く操作ができない。返品保証も 切れて どうしていいのかわからない！",3
"No.100 :","カメラは高画質ではないけどバッテリーは充分持つかな。　この価格ならお得だと感じています。",5
"No.101 :","ボリュームを全開にしてもあまり大きな音は出ません｡",4
"No.102 :","ちょっと良い大きさで使いやすく画面も見やすく疲れないです。",5
"No.103 :","簡単に設定できて直ぐに使用できました。小学生の子供用に購入。格安で助かりました。こどもも喜んでいます。youtubeは問題なく視聴できます。",4
"No.104 :","ワイヤレスマイクを使用してカラオケ用に使用しています又アプリでアンテナ接続しなくてもテレビが見れるのが良いバッテリ-は少し減るのが速い気がするします",4
"No.105 :","薄くて、軽くて、とても使いやすそうです。色は黒でとてもいい感じです。注意点があるとすれば、一緒に付いている、充電器じゃないと、私は充電出来なかった事位ですかね。",5
"No.106 :","子供のデジタル教材用として安価なタブレット端末を探し購入。初めの設定時にアプリのシャットダウンなど少し不安定でしたが再起動したら安定。少しカクカク感、動作が鈍い感、画質がイマイチなどがありますが価格相応で、学習用としては今のところ問題ありません。",5
"No.107 :","ダウンロードも早く、音質もよかったです！Android10なので、動作も早くとてもお値打ちだと思いました(<U+0E51><U+0648><U+2022><U+0300>Δ<U+2022><U+0301>)<U+0648>説明書も日本語なので、わかりやすかったです(o^^o)",5
"No.108 :","購入後すぐに商品到着。充電満タンにして、電源入れてWi-Fi設定してすぐに使えました。子供がYouTube観るのに主に使ってます。携帯より画面が大きいので目への負担が少しは違うかと思い購入しました。",5
"No.109 :","電子書籍を読む用に購入しました。写真はタブレットの上からスマホで撮った物なので少しノイズがありますが、実際の画質は十分綺麗でした！カラーも問題ありません。安心して読めます。少し動作がもっさりしてるので<U+2B50><U+FE0E>4です。",4
"No.110 :","iPad2が古くて使い物にならなくなったので、最新で安価なタブレットを探していてこのタブレットに決めました。iPad 2の動作が遅くてこのタブレットは動作が早く感じます。ただ音質は、お値段相当かな。イヤホンを使えば問題ありません。今のところ特に問題はありません。",4
"No.111 :","普段iPadを使ってますが、改めてiPadの良さを実しました。ゲームには向かないくらい動作が遅いです。",2
