"X1","X2","X3"
"No.1 :","メディアを読み込めませんでした。                      最初Wi-Fiがつながらなくてあせりましたが、ルーターを再起動（電源抜いて、またさす）したら認識しました。予想通り、読み込みが最近見ないほど遅いですが、ユーチューブはちゃんと見れたので満足してます。11990円なので、写ればいいと思っていましたが、予想よりひどくなかったです。相応です。カメラが必要でいくつかアプリを入れましたが、スムーズに連続で撮ることが出来ません。すぐにフリーズ→カメラ再起動の繰り返しです。メモリが貧相なのかもしれません。説明のスペックならサクサクのはずなんですけどね。10インチってでかすぎるかなーと思っていましたが、それほどでもなく１０インチにしてよかったです。もっぱら家で子供がユーチューブみる用です。4/25追加中国製品にありがちな「レビュー書いたらタブレットケースプレゼント」サービスがあったのでレビューを書いたのですが、タブレットケースは送ってきませんでした。中国だから仕方ないんですけど、いや、しかたないのか？タブレットと同時にケースも買

っていたので、くれるかくれないかだけでも返事がほしいとメールを送って見ましたが、それもスルーされました。初期不良などはamazonに送り返したらいいだけですが、「初期不良や満足できないときは、すぐに対応させていただきます」とも書いてあるメールアドレスなので、それも普通にスルーされたらいやだなあと思って★４→★２に変更!",2
"No.2 :","4月から子供が中学生になったので、今まで使っていた小さなタブレットを買い換えました。求める点は3つ①大きくて綺麗な画面②電池の持ち③新しいOS①大きくて綺麗な画面ｍなので、検索など調べ物がしやすく、youtubeなど大画面で見れて満足しております。②電池の容量も6000mAhあるので、1日使っても十分持ちます。夜中に充電して十分使いまわせます。③これはある意味1番重要かもしれない。タブレットが古くてOSのバージョンアップができず、子供が遊んでいたゲームが出来なくなった。なのでなるべく最新のOSの大画面タブレットを探していた。値段もお手頃でちょうどよい買い物でした。",5
"No.3 :","まったく同じく充電ができない？電源が入らない。交換してもらいましたが、使って半年最初の物と同様電源が入らなくなりました。さすがにもう言うつもりなく他のタブレットを購入しようと思います。残念。",1
"No.4 :","YouTubeとZoom用に購入あまりにもカクカク動くので返品することにしました…",1
"No.5 :","私は、10,999円で購入しました。アンドロイド10、10インチで、主に母親にｙｏｕｔｕｂｅ等のネット動画などの閲覧用で購入しました。画質や音質、その他全く問題なく良い商品だと思います。届いたときにはすべに充電（99％）されており、液晶画面フィルムを貼られていました。とても親切だと思いましたが、液晶画面のフィルムは擦り傷があり、また、汚れもフィルムの内側にありました。そのため拭いても拭き取れません。電源をオンにすると見えなくなるのでいつかのタイミングで液晶フィルムを取り替えようと思っています。また、充電についてタイプＣと説明書やアマゾンの説明画面で記載されていますが、実際はタイプＢです。こういうところが本体性能について心配になるところですが、とにかく安さでカバーできています。充電の際にタイプＢのプラグを本体につなぐ際にとても固く、何度も抜き差ししていくと壊れないか心配になってきました。個人的な感想です。母親には母の日を待たずにプレゼントしようか迷っています。追加、電源をオンにすると本当に親切で言語が日本語に変更されており、すぐにグーグルにログイン、ｙｏｕｔｕｂｅアプリもすでに入

っているのですぐに閲覧できます。とにかく親切です。目標は普通に使って2年以上は使いたいと思います。",5
"No.6 :","画面に傷と汚れあり。アリエクスプレスやアマゾンでタブレットを買ったこともあるけどふつう初期状態で、はがす保護フィルムくらい画面に貼ってあるはずだが、これはむき出しで来た。１万だから別にもういいけど、返品品とかじゃないよね。なお、動きはもっさり、タッチ反応鈍い。1万だから。",1
"No.7 :","当たりだったら安い！設定は簡単だと思います、説明書もありました^ ^が、私は見なかったので以前タブレット端末は10年前にdocomoで購入…しかし故障はしていないのにT^TOSが古いのでYouTubeなどが使用出来ないので今回購入しました^ ^☆初めての感想は重い、厚みがあるが第一印象だけどこのお値段でしたら^_^購入して半月まだ２回しか見ていないのに私の場合にはいつも電源をOFFして充電してますが！２回目の充電の際<U+2047>充電のマークが出てない事に気付きすぐ電源ONにしかし画面は真っ暗T^T何度か試み一応充電を１時間ほどして再度試みましたが画面は付くことはありませんでした(o_o)返品をし、また同じ商品を購入しましたが今回は外れでは無い事を願っていますT^Tまぁ一応2台目は外れでは？ないようですが？光回線なのに重いし動画途中にスローモーション(o_o)電源を切、入れて再生すると大体動きます。このタブレットはどの程度持つか？が心配です",2
"No.8 :","今まで使用していたタブレットが壊れてしまったので購入しました。主に子どもが見るYouTubeやTikTokの使用が多いです。クーポン使用で1万ちょっとで買えたので普通に子どもが使う分には満足しています。追記1ヶ月後です。タッチ感度は初めからあまり良くなかったのですが「こんなもんかな？」と思っていたら、、だんだん画面を消しても音がなっていたり、充電がされてなかったり、ボタンが機能しなくなったり…と騙し騙し使ってたのですが、使用するにはストレスばかりになりました。充電が8%の時に「切れる前に…」とケーブルを繋ぎながら見ていたらすぐに充電切れし、その後翌朝まで7時間くらい充電しましたが、12%までしか充電されてませんでした。今までの事もあり、慌てて返品期日を確認したら2日後だったので間に合いましたが、とても残念に思います。他の方も書いてましたが、同封されていたケースプレゼントにもメールを送りましたが、送られて来ませんでした。情報だけ取られたみたいで何だかモヤモヤします。。",1
"No.9 :","今まで使っていたタブレットが古く、容量も少なかったので、とにかく動作が重くてイライラしていたので買い換えを検討しました。こちらの商品は画面が大きいので動画が見やすいです。初期設定もナビに従って簡単にできました。ストレージにも全然余裕ができたので、これからはイライラせずに済みます。",5
"No.10 :","直ぐに壊れた。買って1カ月半過ぎで電源が入らなくなった。",1
"No.11 :","今までのタブレットが相当古いOSでこのたび買い替えました当たり前ですが最初の作業は　Wi-Fiのインストールだと思いますが処理速度　は速いですね！その他画面　綺麗！大きさも小ぶり少し　軽い！値段も　安い！次回からこの値段なら2年　おきぐらいに買い替えても　いいですね！",4
"No.12 :","親へのプレゼントとして購入しました。自分の使用しているタブレットに比べると速度が遅いのが残念ですが、この値段であれば十分だと思います。画面も大きく見やすいです。最初から日本語に設定されているので、親でも使用出来ました。ただキーボードで打つのに慣れている父にはGboardは使用しづらいようで、キーボードをつなげられるのであればキーボードを追加購入してあげようと思います。他の方も書いていましたが、画面の保護フィルムは既に貼られた状態で届きました。充電もされていたので届いてすぐ使用出来ます。",4
"No.13 :","母へのプレゼント用で購入しました。Youtube、AmazonVideoを見るのがメインです。注文後、翌日に届きました。設定も難しくなく、すんなりできました。まだ使用して2日ですが、問題なく動作しています。動画も問題なく見れています。画質はすごく良いかといわれるとそこまで・・・という感じな気がします。ただ、親自身は気にならないと言っていますし、普通に見る分には問題ない程度です。欠点を上げるすれば、２つほど。・電池切れが早いときがある気がします。1時間程度で30％ほど減った時がありました。・重い。今時を考えると厚みがあって、少し重めかなと。ただ、ほとんど持ち運びはしないので問題ないと思います。トータルで考えると、メインで使用しないのであれば、十分だと思います。母は十分満足している様子なので、☆４つです。",4
"No.14 :","主に自宅のWi-FiでNetflixを見るために使用しています。私の使用状況ではサクサク動いており十分な性能だと思います。ただ１つ気になるのは、充電中に点灯するランプ？が無いようで、充電中に点灯するケーブルを購入して対応しました。",3
"No.15 :","動画の画質は良いです。あとは全てがクソオブクソ。バッテリーももちが悪い割になかなか充電が終わらない。カメラの画質もガラケーレベル。タッチ反応悪すぎて液晶パンチしたくなる。モンスト、パズドラ、ツムツムありとあらゆるゲームはインストール出来るが動作が悪すぎて遊べたもんじゃない。音ゲーなんて不可能です。YouTubeを見る為だけのものなのでほかは一切期待しないでください。安物買いの銭失い。同じ値段の中古の旧型iPadを買った方がいいです。オススメは出来ません。購入から2ヶ月、音量調節ボタンの反応が悪くなり音も出なくなりました。返品期限が短く既に返品不可納得いきません。クソチャイナ。",1
"No.16 :","ノートパソコンのセカンドディスプレイとして購入しました。Android10の所為かAirscreenというアプリを入れてもWindows10との間でMiracastは使えませんでした。しかし、spacedeskというアプリをノートパソコンとタブレットに入れたら無事セカンドディスプレイとして使えるようになりました。余計なアプリが最初から入ってない点が気に入ってます。画面が大きいのも良いですね。今度、電子書籍リーダーを入れてみたいと思ってます。",5
"No.17 :","YouTube閲覧とネットサーフィンを目的に購入しました。YouTubeとネットサーフィンは何の問題もなく動きます。パソコンとスマートフォンがあるのでタブレットは不要だと思ったのですがあると便利で、ネットでレシピを見つけて料理をする際や、旅行の移動時間の動画閲覧などスマホで事足りると思っていましたが、大画面だと便利さや楽しさが段違いです。また子供に渡す際によく落としたりするのでiPhoneだと修理費も高くつくためヒヤヒヤですがこれなら壊されても良いか位の軽い気持ちで子供に見せておくことができます。子供からすればiPhoneもこれも変わりませんからね。",5
"No.18 :","価格が価格なので過度な期待はしていませんでした。（私が購入したのはアマゾンアウトレットで約7800円）実際の性能はその低いハードルすら超える事は出来ませんでした。・動作は重くアプリが途中で落ちることもしばしば。・アウトカメラは800万画素とあるが・・・その実データが重いだけで画質はトイカメラ程度。・重い・USBはOTG機能が無く繋げない機器がある。・バッテリーの持ちはスマホ以下・ウィジェットの機能がない全体的にスマホの性能に大きく及びません。それに専用ケースと専用液晶保護フィルムが高すぎる！本体が7800円なのにケースとフィルムで3500円？！ですが7800円で一年保証（アマゾンが販売した商品なので）と思えば許すしかありません。星4つをつける事も2つにする事も出来ません。追記当初は上記のような感想でした・・・ですが気付くと充電用ケーブルがない！そしてバッテリーは6000mAhと表記があるが計測すると実際は4500～5000がいいとこ。「画像が綺麗」と言う方がいますが私には決してそうは思えません。そしてアプリが頻繁に落ちるようになり・・・我慢の限界を超え返品へ・・・その後、1万円

台中盤のCPU4コア 4GRAM メモリー64GB 6000mAhのタブレットを購入すると・・・動作はサクサク、バッテリー長持ち、OTGやウィジェットも使用出来スマホと遜色のない何ら問題の無いタブレットを購入出来ました。このタブレットの定価にプラス4千円で！しかも画質もきれいでバッテリーは長持ちなのに・・・サイズはコイツより一回り小さく軽い！！！あのデカさと重さは何だったんだ？",3
"No.19 :","↑Amazonで購入しました子供達が休日に自分のスマホを独占するのでその代わりにとタブレットを購入してみましたちなみにフォートナイトのプレイ人数を増やす目的もありました・・・結論を言うと、微妙な大きさと重さと操作性がイマイチらしく、子供達は相変わらず自分のスマホを使っていますし、スペックを満たしているはずのフォートナイトは、インストールしても非対応ってことでプレイ出来ず・・・ただ、自分の用途に合わなかっただけで物自体は悪くないので★３つです",3
"No.20 :","使用中のタブレットがOS含め古く動きが緩慢になり購入使用頻度、動画視聴メインですので性能には不満も無く快適に利用できそうですまた画質、スピーカーも予想を上回り妻が喜んでいますストレージも増え動画のダウンロードに余裕もできました設定も日本語説明書もあり簡単に利用できますただ以前のタブレットはHDMIケーブルでTVと接続できたのが便利でした",5
"No.21 :","以前タブレットをネットで購入した時の口コミに「1万円未満のは気をつけたほうがいい」とのことでしたが的中してしまいました( ･<U+0E31><U+FE4F>･<U+0E31>)肝心のウィジェットを画面に配置できません。色々、調べて試したんですがダメで以前、試しに使った『ホーム画面カスタマイズ』のアプリ『Nova』で「確かウィジェットの追加も出来たはず」と思い試しましたら出来ました！しかもAndroidのデフォルトの操作と同じなので簡単に出来ました！前のタブレットが壊れてこの約4000も安い物を買った訳ですがあとは問題なく使えてます。恐らくタブレットの開発者が「安くWi-Fiのみなのでウィジェットの機能は設定しない」と思い怠けたんでしょうね。なので「出来たら中国製の物は買いたくないんですが安い物は100％中国製なので仕方ない」と思い諦めてます(｡<U+2022><U+0301><U+FE3F><U+2022><U+0300>｡)",3
"No.22 :","持っていたiPadが古くなり、iosサポートがなくなってYouTubeの視聴もできなくなった為、急遽購入しました。10,000円しない商品だったので多少不安でしたが、YouTubeが見られればいいかなと思っており、YouTubeはバッチリ見れました。iPad、iPhoneしか使ったことがなかったのですが、設定は思っていたよりもずっと簡単で、15分くらいでアプリのインストールからなにまでやれました。ただ1点気になるのが音でした。iPadはタブレットの左右から音が出るような感覚でかなりクリアに聞こえていたのですが、こちらは耳をあてて確認してみると、タブレットの底の面から音が聞こえている感じがしました。なのでタブレットを何かに立てかけて使うと音がこもったような感じになるのが少し気になります。私は子供が子供向けのYouTubeを見れる事が主な目的だったのでそこまで気にはなりませんでしたが、音質にこだわる方や、iPadのようなクリアな音質がお好みの方は気をつけた方が良いかと思います。購入して1日使ってみましたが、YouTubeを高画質にしたからといってカクつくことなどはありませんでした。

ちなみに画質もiPadの方が良かったので、iPadを理想にして購入される方はやめた方がいいかな？と思います。でもこの値段ですからね。十分だと思います。",4
"No.23 :","プレイストアからインストールするときにこのデバイスで最適化されませんとあるがAndroid10でこんなことありますか？スマホのAndroid10だと最適化とか表示されないです。起動も遅いし重いしアプリは落ちるしで最悪な商品でしたね<U+203C><U+FE0F>重い起動が遅いアプリ落ち画質悪い音質悪いどこもいいところがない安物タブレット買って失敗しました。",1
"No.24 :","ルーターからの距離が制限されるようで、5メートル離れると電波が届かない、いつも使っているところがルーターから2メートル程度でなんとかつかえています、それでも反応はあまり良くないです、ただ価格的に手ごろな価格だけにこんなものだろうと予測して買っただけに予想通りの性能だから納得です、画面はきれいです、大きな問題はいまのところありません。",3
"No.25 :","子供のタブレット学習用に購入。アプリをインストールして起動し、問題に進もうとすると、真っ白にフリーズ。タスク削除しても出来ない。再インストールしてもできない。primevideoも画像が悪い。電池の消耗も早いですね。値段的にこんなものなのでしょうか。保護フィルムもついているのとついてないのがあるのでしょうか？うちのにはついていなかったので、すでに傷だらけです。少し残念です。",3
"No.26 :","プライムデーのセールで買いました！が、翌日も同じ値段、さらにまた値段が下がっているのは残念ですが、値段の割に不安要素なく普通に使えています。動きの早いゲームなどで使用している訳ではなく、YouTubeやプライムビデオ、PDFを見る程度ですが、特に問題なく使用しています。ありがたいのは、購入時に既にフィルムが貼られていることです。そこは感謝。つや消しフィルムだったらもっと嬉しかったですが（笑）フィルムを別に購入することを考えたら、かなりお買い得だと思いました。",4
"No.27 :","動画を見る為だけに使えればいいなと購入。画質、重さは特に問題なく使えるんですが、保護フィルムを剥がしたら画面に気泡が入りました。初期不良なのかな？と思いますが…保護フィルム剥がした程度で気泡が入るとは…ちょっと衝撃です。",1
"No.28 :","届いて直ぐ、設定をきちんとして通信環境も凄く良かったが、通信切断で良く落ちるのがちょっと苛ついた!キャッシュ削除色々、したが通信切断が直らない(￣∇￣<U+0665>)たまに今では、様子を見ながらゲームをしている感じ。とにかく良く画面が真っ黒に成ったり未だにしている！欠陥品か不良品だったのでは？(-_-メ)如何なってるんでしょうね、色々対処とかやりましたが改善されませんでした！故障してるのかも？良く通信切断がしょっちゅうです!タブレットの意味が全く無い！",1
"No.29 :","届くのを楽しみに待っていたので、届いてすぐ電源を入れたけれど入らない充電をしながら電源を入れてみたけれど画面がつかない説明書通り色々とやってみたけれど結局、何の反応もなく不良品のようで、すぐ返品しました楽しみにしてただけにガッカリで、新たに購入する気にすらならず",1
"No.30 :","買って充電したら54%しかならず、連絡して返品手続きしました。気に入って使いかけていたのに、残念でした。ただ、ショップの方の対応は早くて助かりました。",1
"No.31 :","主に動画でドラマを見る為に、購入しました。ダウンロードしてから見るので画質が乱れたりといった事も無く楽しんでいます。ちょっとした検索とか日常使いには十分。手頃な値段で、設定が得意でない私でも出来ました。",3
"No.32 :","Primevideoなど動画鑑賞用に購入。初期設定などは問題ありませんでしたが、いざ動画を見始めると残念な事に１本の映画鑑賞中字幕が読めない程度まで画質が粗くなることが３～４回。（YouTubeでも同じ症状は出ます）その都度止めてタイトル画面まで戻して再生しなおすということを繰り返しています。値段が安いので仕方がないのかもしれませんが残念です。画質も綺麗とは言いがたいので動画鑑賞されるのならこのタブレットはあまりおすすめしません。",2
"No.33 :","動作が結構遅いです。スマホやPCのようにサクサク動くという感じではありません。設定等は日本語の説明書があるため問題なし。youtubeなど動画を見るだけでしたら画面はかなり大きいのでストレスなく見れます。スマホで動画をみるには小さすぎるという方におすすめです。",4
"No.34 :","ビデオ通話（skypeとDUO）をするために購入。音声通話しかできません。わざわざレンタルで他社（HUAWAI)のタブレットを借りてきて比較実験をしましたが、HUAWAIはビデオ通話が難なくでき、コイツはダメ。音声通話からビデオ通話に切り替えるとWi-Fiのアンテナマークが消え回線が切れる。youtube専用となりました。",1
"No.35 :","翌日配達にもかかわらず、発送元の手違いからか遅延。楽しみにしていたのに、いざ充電して…接続してから半日経過しても全然立ち上がらず。すぐに使いたかったのでプライムで手配したのに、期待外れもいいとこです。即返品、交換の手配をかけましたが、交換は返金後に再度購入手続きを…メーカーから連絡もないので他の物を購入しました。",1
"No.36 :","タブレット本日受け取りました｡有り難うございます。無知な私でも説明書で､初期設定出来ました。画面は、綺麗で､バッテリーは、長時間持ち､１０インチと､大きないのですが、軽く､使いやすいです｡現在は、早速に､ゲームやりながら楽しんでいます。又よろしくお願いします。",5
"No.37 :","ゲームをする為、安いタブレットを探していたので商品を手にした時もたいして期待もしていなかったのですが、実際使ってみて以前使っていたNECの製品とほぼ遜色なく、非常に満足しています。Google playストアからYouTubeやYahooの野球ライブなどをインストールして毎日使わせてもらってます。",5
