"X1","X2","X3"
"No.112 :","子供が取り合いするので、個々にYouTubeを見せるためにこちらを購入。ほとんど動画しか見てないので、他に容量を使わないので、かなりサクサクです。タッチも感度が良く、使いやすいと思います。約10000円で購入も出来きコスパが良いです！",4
"No.113 :","元々Androidのスマフォを使っていたので、とても分かりやすかったです。日本語の説明書も助かりました。小学生の子どものオンライン課題のために購入しましたが、文字入力が分かりやすいので、直に一人でできそうだなと思っています。スマフォで困っている母にも勧めようと思っています。",5
"No.114 :","購入して１ヶ月で２度もフリーズ<U+203C><U+FE0F>ファンの回るような音がして動かなくなり何度も電源ボタン長押しでやっとシャットダウンできました。２回目になるとまたかと呆れるしかないw充電がMicroUSBなのでかなり時間がかかります<U+203C><U+FE0F>",1
"No.115 :","動画鑑賞用に購入しました　使いやすくて満足しています初期設定も簡単でよかったです。",4
"No.116 :","まず梱包は綺麗でした。箱を開けてみるとお洒落なタブレットの登場でした。最初についている保護シールも説明付きと普通よりも丁寧な印象です。挨拶カードもありましたので信頼できるものと考えております。いまのところ動作不良などもありませんので、星5つです。",5
"No.117 :","子供のこれからのタブレット学習等の練習や、youtubeで曲の視聴が頻繁に必要となってきたので購入しました。初めてのタブレット購入です。画面の大きさもちょうど良く、新しいOSでなかなか快適に使えております。",4
"No.118 :","車内で動画を見る用の端末が欲しくてこちらを買いました。動きはそこまで早くはなくヌルッと動く感じです。ただコスパは高いと思います。動画を見る程度であれば問題なく、個人的にはいい買い物をしたなと思います。ブルーライトカットのアプリが利用できないので☆４つにさせていただきました。",5
"No.119 :","dtubが壊れたのでYouTube用に購入。設定もdtubで使っていた内容を引き継いでくれたので楽チンでした。音があまり良くないなと思いますがこの値段で文句は言えません。画面も大きいし見やすいです。",4
"No.120 :","アマゾンのFireHDと悩みましたが、こちらが、グーグルプレイが入っているため購入。立ち上げ、wifi設定も簡単。基本、自宅使用ですが、スマホ感覚で、Bluetooth接続も簡単でした。アプリも色々取り込んだり、オンライン講義など、活用してます。お勧めです。",5
"No.121 :","安いなりの画質です。YouTubeやサイト閲覧ぐらいであれば問題ないかと。ゲームやってみましたがロブロックスはラグあり、オセロニアはできない。基本負荷の少ないゲームならできるのではないでしょうか。まぁ子供用に購入したので問題はないです。",4
"No.122 :","普通に動画を見て満足する品です",5
"No.123 :","母に頼まれて購入。初期設定も簡単ですし、この値段で買えるのがありがたいです。あとはどのぐらい持つかわからないので、星3です。",3
"No.124 :","買って2週間ですが、使ってる途中で急に電源が切れて、充電をしたり、電源を長押ししたり、色々としてみたが、全く動かなくなりました。",1
"No.125 :","若干動きが遅いですが、子どもと趣味に使う分には、問題なく大満足です。軽くて、薄くて扱いやすいです。Androidのタブレットを初めて購入しました。スマホがAndroidだったので、使い方が同じで、操作しやすいです。",5
"No.126 :","心配でしたが、設定が簡単でタブレット初心者には十分です",4
"No.127 :","郵送に関しましては、特に問題ありませんでした。実物も少し使用しておりますが特に問題なさそうです。ビジネス用などではなく、基本居間での子供用などに使用しておりますが特に問題は今のところなさそうです。",4
"No.128 :","大きめのタブレットなのでネットサーフィンもし易く、色は黒でないものが良かったけど贅沢は言えないほど価格も安く、大変嬉しかったです。",5
"No.129 :","画質は値段のわりはいいと思います。バッテリーは動画で1時間で10%減る感じです。iPhone、iPadが慣れていたので慣れるまでは使いにくい。コスパは良いと思います",4
"No.130 :","子供が、私のスマホでYouTubeを見たり、ツムツムをやりたがるので、子供用に購入しました。LINE通話も出来るし、写真、動画も撮れて楽しそうです。",3
"No.131 :","プレミアムデーに割安で購入できました。子供のスタディサプリ専用機です。向きが片側にしか向きませんが、使用用途には十分です。",3
"No.132 :","画質が、やはり少し劣るので、もう少し値段上げてもいいので作って欲しいかもです。最初から、フィルムが貼ってあるので買わなくていいのは、とても良い。",4
"No.133 :","子供にいつもYou tube等でケータイを取られてたので、代わりとなる安いタブレットを探していたところ、安く購入できて非常に助かりました。もちろんケータイよりも画面が大きいですし、子供達も大満足です。",3
"No.134 :","今まで使っていたタブレットが古く、動作も遅く、買い換えました。こちらの商品は画面が大きいので動画が見やすいです。初期設定もナビに従って簡単にできました。送付の対応もよく満足しています。しばらく使ってみようと思います。",5
"No.135 :","YouTubeでハワイやコストコの情報をスマホで見ていましたが、このタブレットを購入したことで、テレビにつないで大画面でハワイ旅行やお買い物情報、簡単ダイエットなど楽しむことができました。画質も良く満足しています。",4
"No.136 :","最初はよく動いたけど、突然電源が切れて、バッテリー切れかなと思ったけど、そのまま17時間もつかず結局返品。性能はいいんだけどなー残念。",3
"No.137 :","YouTubeを見ながらスマホを使うために買いました。バッテリーなどは結構長く持ち、タブレットにしては軽いので持ち運ぶのにも楽でいいと思います。画質が少し荒いのでそこが気にならない人にはオススメです。",4
"No.138 :","動画を観るのを主目的として購入しました。画質も十分、バッテリーも短くない。ネトフリやYouTubeを観る分には申し分ないです。追記電源がつかなくなりました、",1
"No.139 :","実家の両親がガラケーなので LINEでの通話や映画観賞用に購入しました。普通に使用する分には問題ありませんが やや本体重いのと速度がやや遅いですがコスパは良いとおもいます。両親も孫の動画や映画を喜んでLINEも練習しています（笑）",4
"No.140 :","クーポンなど使い、1万円で購入できました！主に入浴中の動画鑑賞に使っています。正直音は良いとは言えませんが、動きと画質は悪くないです。1万円でこの機能とAndroid10であれば、充分です！",4
"No.141 :","驚きです！最初は、保証書ないし。こんな今どき不良な！ものが、届けてくるとは、正直アマゾンに対し不安気持ちになりました。改めて通販の難しさ感じました！　せめて、敏速な対応願いたいです、今後の対応見ております！",1
"No.142 :","バッテリーの持ちが悪く、画像もボヤケぎみ、cpu動作もかなり遅いです。",1
"No.143 :","安いので費用対効果としては満足です。よく固まります。WiFiの感度はよくありません。",3
"No.144 :","おもにゲーム",4
"No.145 :","動画視聴の為購入しました。設定も簡単でこの値段なら満足です。バッテリーの持ちも良いです。ただ、動画のダウンロードにスマホより時間がかかるので、☆4にさせてもらいました。普段使いには充分だと思います。",4
"No.146 :","初めてタブレットを購入しました。今日届いたのでバッテリーなどは分かりませんが！思ったよりも軽いし良かったです。ただカメラの画質は悪いです",3
"No.147 :","youtubeで画質を1080以上で見ると、動画がカクカク動き見れたものじゃありません。それ以下だと普通に映ります。アマプラの動画はダウンロードだとカクカクせずに動きます。",1
"No.148 :","子供の学習用にタブレットが必要になり注文して翌日に届きました。充電して初期設定すればスグに使えて問題はありません。10インチで使いやすいですしとてもコストパフォーマンスが良いと感じました。",4
"No.149 :","初めて中華のタブレットを購入したので不安ありでしたがyoutubeとAmazonprimeと本が読めればよいので全て大丈夫です、画像もきれいですよ<U+0001F603>多少タッチの感じとかカクカク感はありますが問題はないです",4
"No.150 :","子供用にお手頃なタブレットを探していたところ、この商品を見つけて即購入しました。使い勝手も良く満足してます。5G対応していればもっと良かったと思います。",4
"No.151 :","子供の学習用で購入しました。値段も手頃で学習のアプリで起動しないものがありましたので★3をつけたいところですが、タブレットには満足しているので★5です。それが解決できれば文句なしに★5です。",5
"No.152 :","電子媒体でコミックを読みたかったので購入。これまでiPhoneで見ていたので物凄く快適になった。購入の目的は果たせたので満足。買って良かった。設定も簡単だった。、",4
"No.153 :","YouTubeの画像が少しかすみがかった感じ、写真うつりもハッキリしない。安さい商品だから仕方がない。",3
"No.154 :","田舎の父母とビデオ通話を大きな画面でしたくて購入しました。スマホだと画面が小さいので。。。問題なく動作しています。孫の顔を大きな画面で見れるので、喜んでくれています。コスパがとても良いと思います。",4
"No.155 :","母親に買いましたが、使い勝手も良く喜んでました。パソコンの代わりに検索したりするのをメインに使ってますが十分です。私にしたら少し遅く感じますがYouTubeも母は大満足です",5
"No.156 :","思っていたより重く 寝ながら使う事はきつい。画質があまり良くないけどスマホとの連携がスムーズにでき使いやすい。",4
"No.157 :","netflix・youtube視聴専用の為、購入しました。この価格で、これだけ使えれば十分です。マイクロsdにてストレージも128GBに容量アップ。10インチタイプのタブレットにしてはこの価格は上出来です。",5
"No.158 :","バッテリーがフル充電するのがまず10時間かかるのに3時間の使用でゼロになります。",1
"No.159 :","応答速度などは一般的な使い方なら充分かと思います。液晶画面は保護シートなどが貼られていないため新品なのに擦り傷がついていました。市販の保護シートを貼れば目立たなくなりましたが、そこが残念です。",4
"No.160 :","子供が私のスマホを触るのが嫌で、タブレットを購入しました。You Tubeやゲームが中心ですので、このお値段で十分満足です。私もレシピ動画を大きい画面で見ながら、料理てきて大満足です。",5
"No.161 :","使って1ヶ月ちょいで画面のタッチが出来なくなりました。最悪です",1
"No.162 :","初めてのタブレットデビューでしたが、サクサク使えて大満足でした！ありがとうございました(^^)",5
"No.163 :","なんといっても安いですね。子供の動画見せる用に買ったので処理速度は遅いようにも感じますがこの安さでこの画質、性能、大満足です。",5
"No.164 :","簡単にandroid10を楽しめます。SDカードのでっぱり気になるところではありますが、それ以外はgood!",5
"No.165 :","Amazonプライムデーに購入。主にYouTube再生用として買いました。価格が安いので不安でしたが、設定も簡単。YouTubeもなんの問題もなく見れており満足しています。",4
"No.166 :","お店で動画を流すために購入しました。画質もキレイで見やすいです。大きさも悩んで８インチではなく１０インチにしましたが、動画を見るにはちょうど良い大きさでした。",5
"No.167 :","セットアップも日本語スタートでらくらく簡単でした！厚さもiPadぐらいで、重さも感じなく1年生の子供も使いやすそうです！タブレット学習にも活躍期待大です。コスパ大満足。",5
"No.168 :","値段が安いので心配していましたが、画面も綺麗で見やすく、動作も問題なくサクサク反応してくれます。このお値段で長く使えればお買い得だと思います。",5
"No.169 :","まだ来たばかりで　よくわからないけど、スマホとの同期は　すぐにできました。タブレットに同封されていた案内に連絡したら　タブレットカバー　もらえました。",3
"No.170 :","バッテリーは減りが早いし残量少なくなってもお知らせがないので、いきなりシャットダウンしてしまって故障してしまったのかと思いました",3
"No.171 :","スマートフォンでは字が小さくて困るという母のために購入しました。大きくて見やすくなり喜んでいます。多少、初めの設定に苦戦しましたが使いやすいと思いました。",5
"No.172 :","親にプレゼントしました。思っていたより使いやすくてよかったです。画面も大きく綺麗で、両親も大満足でした。自分用にも追加の購入を検討してみます。",4
"No.173 :","取り扱い説明書にあるアドレスにメールしましたが返事がきません。電話番号もありません。QRコードを読み込みません。アプリ内にあるQRコードも同様です。使えません。",1
"No.174 :","店舗内で使用する為に購入しました。ＳＮＳやアプリの為だったので問題なく使用しております。お得な価格が一番の売りだと思います。",4
"No.175 :","安くて買やすく、使い勝手が良い",3
"No.176 :","YouTubeを見るために、購入しました。この値段で、このクオリティなら十分だと思います！ありがとうございました。",5
"No.177 :","今回、子供と一緒に使う予定で購入しました。予想より大きく、使いやすく見やすかったので子供と大満足です。子供の勉強にも、とても役立ってます。",5
"No.178 :","低価格で、最低限使いたい機能が使えて、言うことありません。毎日利用しています。バッテリーも動画を流しっぱなしでも長時間つかえるため、プライムビデオをみるのにちょうどいい感じです。",4
"No.179 :","YouTubeなどのアプリがあらかじめインストールされているので、すぐに使い始めることができました。、こどものYouTube用に購入しましたが、画面が大きくて気に入っているようです。",5
"No.180 :","動画再生用に購入しました。iPad以外のタブレットを購入するのが初めてでしたが今のところ問題はありません。意外と軽くて布団に入りながら使用しています。",5
"No.181 :","ピンチインとアウトが出来ませんでした。また、最新と言う事でしたが他のタブレットより起動、動作が遅かった。",1
"No.182 :","カメラ映りません真っ暗です",1
"No.183 :","正直、思っていた以上に画質、使い勝手良いです。セットアップも簡単に出来て、ゲーム、動画も滑らかに動きfire と異なりAndroid対応なので、アプリの幅も広がり良かったです。",4
"No.184 :","自宅用に購入しました。手頃な値段で、この性能なら充分です。電子書籍やオンラインノベルを読むのがメインなので、大きい画面が見やすくて良いです。",4
"No.185 :","子供用として購入しました値段が安いので不安もありましたが、動画、ゲーム、全く問題なく使用でき、満足してます特にバッテリーの持ちは◎",5
"No.186 :","レビューにもあったがWi-Fiが2.4GHzにしか繋がらない以外はさほど問題は感じない。外ではスマホのテザリングにも繋げたし普通に使える。少し思いかなという程度。",5
"No.187 :","娘のLINEやYouTube用に買いました！タブレットは、初めて購入したので少々不安でしたが、何の不満もありません。娘も大満足しています。",5
"No.188 :","動画を見るのに、ダウンロードをし持ち歩くために購入しました！ちょうどいいです！",5
"No.189 :","値段の割にはある程度動く。電池の減りが早く充電も時間がかかる",4
"No.190 :","会社の研修や講義、スマホで対応出来ますが、老眼がはじまり目の疲れを感じていたところです。画質も良く大変感謝している所です。ありがとうございます。",5
"No.191 :","小学生の子供にYouTube用として購入しました。値段が安かったので、それほど期待していませんでしたが、映像の動きも良く困ることはありませんでした。買って良かったと思います。",5
"No.192 :","無し",5
"No.193 :","中国製品のため、初期設定に不安がありましたが、スムーズにできました。バッテリーの持続時間等はこれから使用して確認するため、星３としています。値段のわりに良い製品だと思います。",4
"No.194 :","動画を見るために購入YouTubeを流し見するのにちょうどいいです。お手頃な価格で機能も動画視聴や読書に使うには十分かと思います。",4
"No.195 :","使ってまだ１日ですが、今のところ全く問題ありません。むしろ、期待してなかった分（笑）かなり満足してます。",4
"No.196 :","YouTubeやNetflixのために買いました。重たいゲーム等はiPad等ほど動かないかしれませんが、私の用途としては満足です。1万円で10インチは良いなと思いました。",4
"No.197 :","見た目が安ぽかった！充電100%で、電源を入れて95%に直ぐになる。液晶画面がデコボコお薦めはしません<U+203C>",2
"No.198 :","ちょっと重いけど、思ったより画質はキレイです。人によってかなりレビューが違うので心配でしたが、自分が使う用途には今のところ問題なさそうです。",3
"No.199 :","amazon video、music利用で購入。アプリやmusicのダウンロードに時間はかかるものの、動作に関しては、比較的ストレス無く作動しています。",5
"No.200 :","画質、早さ値段通りです。iPadも使ってますが比べてはいけません。",4
"No.201 :","持っていたタブレットが、充電が出来ずイライラするので、こちらを購入。操作が、簡単な所が今のところ助かってます。",5
"No.202 :","両親用に購入。タブレットははじめてでしたが画面が大きく見やすいです。バッテリーの持ちも良好です。自分用にもほしくなりました。",4
"No.203 :","購入額\10499この金額でこのスペックはお得かと思います。ただバッテリーの充電に時間が掛かるのと、減りが早い気がします。",1
"No.204 :","画質がとっても綺麗でした。様々な機種を調べましたが、コストに対してパフォーマンスが良く、動作の速さや画質の良さ等どこをとっても満足です。",5
"No.205 :","この価格でなら 何の不満もありません。いい買い物だと思います。ありがとうございました。",5
"No.206 :","この値段でこの性能でしたら申し分ないと思います！！",5
"No.207 :","子供のゲーム用に購入しました。このお値段でしたら大満足の商品でした。PINを入れずに使用する方法を模索中ですが、それ以外は問題なく使えます",5
"No.208 :","動画視聴用に買いました。画質など特に問題なく使えます。スピーカーが前についていないので音は少し聞き取りづらいかもしれません。",4
"No.209 :","この値段で買えるのはおどろきです。母へのプレゼントでしたか、自分用も買おうかしら…と考えています。",5
"No.210 :","動画を見る為に購入しました。軽くて画像もきれいです。まだ使い始めたばかりなので、バッテリーや動作不良はわかりませんが今のところ満足です。",4
"No.211 :","動画視聴、ネットサーフィン、資料を表示させておく為に購入。簡単な処理を手軽に使用する分には全く問題ありません。この価格でこの内容なら十分満足です。",5
"No.212 :","子どもの学習用にタブレットを探していた。性能と価格を考えるとコストパフォーマンスが良いと思う。",5
"No.213 :","とんでもなく古いタブレットを使用していたので新しく今回こちらを購入しました。大画面で画質も良くお値段も良心的で文句無しです。",4
"No.214 :","子供用として購入しました。値段が安いし、動画、ゲーム、全く問題なく使用できます。予想以上のコスパで満足してます。",5
"No.215 :","迅速な配達で包囲もきちんとしてました。商品もまあ値段から考えてもお得感があり、画像も綺麗だと思います。使いやすいです。",4
"No.216 :","自宅のWi-Fiでインターネットを楽しむ為に購入しました。動画もきれいに鑑賞できます。この価格でこの性能なら、コスパは最高かと思います。",5
"No.217 :","値段が安いですが、性能は思っていたより良い。どうしても反応は遅く感じますが、画質は良く動画視聴には支障は無い。今の所買って良かったです。",4
"No.218 :","サクサク動くし画面も綺麗で見やすく使いやすくて大満足です。",5
"No.219 :","立ち上げて直ぐの動きは遅いです。ネットを見るだけの購入しましたが、十分です",3
"No.220 :","動きが悪い。",1
"No.221 :","使用期間は1週間ほどのレビューですが、問題なく使用できており、値段を考慮するとすごくコスパの良い機種だと思います。",5
"No.222 :","とても画像が綺麗で、このお値段でこのスペックはとてもいいと思います。充電も満タンになっていてすぐ使えて助かりました！",5
"No.223 :","妻がレシピ動画を観るのにタブレットが欲しいと言うので購入しました。問題なく使えています。ちょっと使いにはリーズナブルで良い買い物だと思います。",4
"No.224 :","子供のYouTubeキッズ用に購入しました。画質は問題ないですが、液晶の反応が少し鈍目です。しばらく使用してみます。",5
"No.225 :","YouTubeや漫画や雑誌を見るために買ってみました。十分満足しています。嫁さんにも買ってあげました。",5
"No.226 :","母が漫画が読みたいとのことで、購入しました。重さがどこにも書いてありませんでしたが、とても軽くて設定も簡単だったので気に入っています。",5
"No.227 :","10インチ大きいだけあって多少重量感はありますが、画質、バッテリーの持続時間には満足です。値段を考えると非常に良い買い物となりました。",4
"No.228 :","設定も数分で出来、軽いし気軽に持ち運べるしとても気に入りました。安いしとても気に入りました。",5
"No.229 :","8歳になる娘の誕生日プレゼントとして購入しました。何一つ問題無く大喜びです。値段も安く、最高です。",5
"No.230 :","画質はちょっと…でしたが、使いやすさがすごくいいです。子供たち用にと思い購入しましたが、自分も使いたくなる魅力的なタブレットでした。",4
