"概して素晴らしいです。本製品の前に、5,000円のノーブランド、20,000円のAmazfit使用しましたが、どちらもまったく使い物になりませんでした。結果、スマッチ(スマートウォッチ)ってまだまだ使えないな、やっぱりアナログに戻そうかなとも思いましたが、これは本当に購入してよかったと思っています。【デザイン】格好良い。ビジネス・プライベートいずれもフィットします。盤面はカッコつけてアナログ針式をしばらく使っていたのですが、視認性の高いデジタル数字表示にしました。日付確認も即です。【操作性】盤面を向けたときの表示反応も早く満足です。電話機能は科学特捜隊みたいで格好良いですがあまり使っていませんw【機能性】非常に優れていると思います。自転車でのワークアウト記録に重宝します。またスマホからの音楽をワイヤレスイヤホンで聴いているのですが、その操作を本機でできるのが便利です。【サイズ・装着感】盤面が非常に大きく、視認性も高くていいと思います。重さを感じることもありません。ただ腕が細い方は多少つけさせられている感があるかもしれません。【バッテリー】よく持ちます。使い方次第とは思いますが、私の場合、5日ほど余裕でいけます。しかも2時間も充電させておけば即満充電です。【残念な点】気温がわかりません。気圧、皮膚温度は測定してくれるのに、現時点での気温がわからないのはどうして?まあなければないで別によいのですが。"
"スマホはiOSです。基本機能以外使えない(追加でアプリを入れられない)事は承知の上で購入しました。概ね満足しています。各種ヘルスケアの数値も正常に動いているようです。アップルウォッチにしなかったのは時間が知れて体の状態がある位程度分かれば良かった事と、四角い形が好みに合わないからでした。文字盤の多彩さもオススメです。無料のものも結構な種類があります。有料も60円くらいから500円くらいのものまで様々で100種以上は裕にあります。ただシンプルめなのは少なく、ごちゃごちゃした男の子が好きそうなものが7~8割くらいを占めています。わたしのように文字盤のデザインが最重要の方のためにいくつかページを載せたいと思います。(JPY~は有料でその料金、インストール-は無料、新しいデザインも定期的に増えていてたまにセールもしています。購入には会員登録とクレカの登録が必須でした)安眠を助ける項目については睡眠の数値を知れるだけで意識してコントロール出来るわけではないので評価出来ません。電池はとても優秀だと思います。"
"スマートウォッチ5台目とにかく見た目がオシャレです通知振動、計測も申し分ないです買って良かったですね"
"期待通り"
"今まで特に不満なくHUAWEIバンドを使用していましたが、ベルトが老朽化してきて交換しようかと思った時にこの商品を見つけて興味を持ちました。バッテリー最大14日間と書いていますが、普通に体表温度常時計測や他の機能も使用して一週間くらいでしょうか。それでもHUAWEIバンド（4日に一度くらい）に比べたら格段に充電までの時間が延びるので、とても満足しています。※アップルウォッチも視野に入れましたが、時計？に毎日充電するって有り得ないので・・・HUAEWIバンドからの移行でもあるし特にアプリも動かす必要もなく、クリスタルガラスやチタンボディも必要性を感じなかったので（通常の腕時計とは違って技術も進歩するので、買い替え頻度も高いだろうし多少傷ついても良いかな、と）こちらを選びました。"
"HUAWEIの時計バンドは機能もデザインも本当によく考えられていて感心する。SEIKOもシチズンもブランドに胡坐をかかず、こういった部分にもちゃんと目を向けないと足元すくわれるよ。"
"噂とおりのバッテリー持ちにびっくり。普通に１回充電すると10日程度持ってくれます。充電を気にすることなく使用出来るのは最大の利点と感じました。ディスプレイ表示は購入当時はアナログ風を使用していましたが最近はなんとなくデジタル表示の方がしっくりくる感じでそちらがお気に入りです。ハードのデザイン自体も普通の時計っぽく好感が持てます。計測記録機能に関しては、睡眠時間の記録などの精度は不明ですがデータとしては非常に興味深く、なんとなく生活をパターンなどを意識するようになるので、結構楽しいなと感じます。ただ、機能はたくさんなのですがほぼ使いこなせない気がしました。"
"タイムセールをよく調べて購入しましょう🖕時計は良いのですが、高い買い物をしました。これからは 慌てず様子を見て購入します。"
"バッテリーの持ちは良く、また日々の体調管理に役立っています。三日坊主になりがちのジョギング習慣も、これに急かされて日々こなしています。良い相棒です。"
"Huawei WATCH GT2からGT3にしました。裏面がシンプルになったため、汚れが付きづらいです。見た目は安っぽいですが。(裏面を見せることはないですが)電池の持ちは、GT2の方がよかった気がします。体感で、GT2は10日間、GT3は7～8日間という感じです。体表温度など機能が追加されたため、やむを得ないのかもしれませんが。"
"ＧＴ2も所有しているがかなりの部分で進化していると感じる、ただ買い替えが必要なレベルかといえば動作のもっさり感が気にならないなら私の使い方では２で良いかな、ってレベルです!"
"ものすごく便利なのでずっと着けてますが、アナログ表示の分針の動き方には非常に不満があります。59秒から00秒になるときに分針が1分動きます。 かれこれ50年以上普通のアナログ時計に慣れてしまっているので、あと1分あると勘違いして焦ることもしばしば。 これを設計した人たちは1分なんて気にしない生活なんでしょうかね。 無数に選べる文字盤ギャラリーの中には分針がジワジワ動くアニメーション見本もありますが、どれをダウンロードしても分針は1分ステップでした。"
"期待どおりの製品で、購入してよかったです。"
"商品については、満足していますが、到着日の記載があまりにお粗末、本月1日に申込してお急ぎ便で2日に到着予定となっておりますが、近県ならまだまし、遠方県からの発送で2日に運送会社に持ち込みしているのを荷物追跡から当方確認しており2日に到着は無理と判断していましたが、やはり早朝に持ち込んだとしても2日に到着は不可能、結局4日の夕方に到着しました。発送県と到着県を確認して頂ければおのずと何日に到着するだろう予測がつくはず、出品店舗がもうすこし配慮が必要だと思われた。"
"ジョギングの為にスマートウォッチを探していましたがapple watchは値段が高すぎるのとこちらの商品はデザインが非常に好みであった為にこちらを購入しました。また、一部有料なデザインもありますが、画面を自分の好みなものに変えられるのも◎やはり時計は○型がしっくり来ます。ワークアウトメニューが豊富で運動する際のお供にするには十分すぎる性能を持っています。電子マネー連携などのユーティリティは存在しないので、そういったものを求める場合は別のものを購入されたほうが良いです。運動メインで使用される分には心拍、VO2Max等測定機能は標準装備ですし全く問題ありません。あとは何よりバッテリーの持ち具合が半端ないです。ガチで２週間保ちます。毎日充電出来る環境なら気にする必要は無いと思いますが、出先で使いたいとなった時にこのバッテリーの保ちは非常に心強いです。iPhoneとは相性がやや悪く、連携用アプリはあるものの、スマートウォッチへの音楽への転送ができません。また、iPhoneのアプリ側の設定によってはiPhoneの電池がめちゃくちゃ減ります。バックグラウンドでも時計と連携しているとそうなるようです。なので自分はいつもはバックグラウンド設定は切っていますが、屋外ジョギングなどワークアウト開始時には一度スマホとの連携を復帰させなければならないので、ここがやや不便。自分は結局スマホも持ったままジョギングしています。ワークアウトメニューは本当に豊富で、どうやって計測しているのかわかりませんが屋内スイミングでもきっちりと距離を測ってくれます。歩数計も割と正確だと思います。歩いた歩数や距離が常に分かるので、このあたりは運動のモチベアップになりますね。一度外でジョギング中に電話が掛かってきたことがありましたが、その時はスマートウォッチが受け口となりました。通話はなんとか出来る感じです。ワークアウトに特化した時計で、逆に言うとapple watchのような多機能ではありませんが、この値段でこの性能なら文句は無いと思います。デザイン、バッテリーの持ちが非常に優秀なのも良いですね。"
"軽いし、バッテリー持ちはいいし、ベルトも簡単に変えられます。この値段でこれだけの性能があれば、文句なしです。仕事でもプライベートでもベルトを変えながら使ってます。"
"アイホンと連携が心配でしたが、ライン、メールの通知が時計側でわかり便利です。"
"ヌルヌルサクサクすごいです。見た目もシャープでかっこいい！文字版も無限！？っていうくらいあります！もちろん無料も！唯一のデメリットは、オリジナルアプリ以外への対応がないこと。色々あるとは思うけど、Suicaとかスマートロックとかに対応したら最強クラスになると思う。"
"GTからの買い換えギャラクシーウォッチと悩みましたが買ってよかった。"
"デザイン良し専用アプリが少ないので機能を使いきれない。自分は気に入って使っているものの、この価格なら他のスマートウォッチのほうが機能面で充実しているものがあると感じているとりあえずiPhoneユーザーはアップルウォッチを買ったほうがいいですね"
"週三回のジム通いで大いに役立つ。心拍数や歩数計など。血中酸素濃度も目安になる。運動中、ラインが来てもわかる。電池の持ちは5日間。ジムでシャワー浴びても問題ない。ただし付属の皮ライクのベルトではなく別にシリコンラバーのものを購入して使っている。付属ベルトは良い色。等々考えると十分価値はある。簡易ナビを使おうとしたが、認証されていないアプリをガンガン入れる必要があり、面倒かつ怖くなってやめた。中国に行くこともあり、セキュリティが担保されていないものは入れたくない。そういう意味では携帯に支払い機能は持たせていないので大丈夫だとは思うが。軽くて基本機能はしっかりしており、3万円と言う値段を考えると十分行けると思う。これを買ってからスイス製の時計が重く感じて使わなくなってしまった。"
"性能的には不満はないですが、もう少し軽ければ　もっといい。"
"デザインが良くて、バッテリー持ちも良くて、コスパもとても良いと思う。何故、星が一つ少なく4 という評価かというと、以前購入していたこれの前バージョン GT 2 が2 年ほどで壊れた為、これに関しても耐久性に一抹の不安を覚えるから。"
"Watch GT2からの買い替えです。プライムデーで大幅に値引きされていたため衝動買いしました。バッテリーの持ちは期待通り。リュウズを回しての操作もやりやすい。バンドの脱着も付け根のボタンを押しながら外すように変わっており、これもやりやすい。バンドの品質も良くなっています。大満足です。"
"以前シチズンのソーラー充電時計をしてたので、スマートウォッチの電池は概ね不満でしたが、これはいい旅行も安心していける、欲を言えばキリがないが値段と合わせ満足"
"miwatchからの買い替えです。miband5→6、huaweiband6→miwatchそしてこちらの機種に変更してきました。bandの物はトレーニングには良いのですが、さすがに仕事の時などでは見た目に問題ありです。そこでMiWatchにしたのですが、なんとmi体組成計とアプリ内で連携ができなくて、仕方なく手動で入力していました。しかも中華製品はgooglefitと連携も取れずデータもバラバラになります。mibandで使っているzepplifeアプリのみスマートバンドと体組成計の両方と連携できます。huaweiもgooglefitとの連携はできないです。今回は、huaweiwatchGT3とhuawei体組成計を購入したので、ヘルスケアアプリのみで両方のデータを管理できました。おかげで、xiamiとgooglefitをアンインストールしてアプリを減らして使いやすくなりました。また同じアプリでhuaweiband６とのデバイスの切り替えも簡単なので、今は夜間はband６を使用して睡眠の確認をしています。希望としては、上腕式の血圧計のデータも入れば手入力が要らなくなるのですが。後、通話の品質も思ったより良かったです。スマホをカバンに入れてしまうので意外に助かります。"
"信じられなくくらい電池が持たない。１４日持つは１４時間の間違いか？　あらゆる機能をＯＦＦにして消費電力を最小にしているが、夜中に充電して午後には残り２０％まで落ちてしまう。売りにしている常時ヘルスチェックをオンにすると数時間で電池切れです。訂正です。デバイスを再起動したら持つようになりました。多分バグだったんでしょう。心拍、血中酸素濃度、ストレス、皮膚温度、睡眠のすべてを自動計測にして、１日20%の電池消耗です。5日は持ちそうです。"
"基本、本器の機能に大変満足しています。ただジョギング時の心拍数がかなり多めに出る場合がほとんどで困っています。通常使用時は安定しているのに残念です。ヘモグロピンの色や血圧等による個人差かもしれませんが。太い血管を避けたり、ベルトの締め付けを変えたりしましたが改善されませんでした。GT3は心拍計測アルゴリズムTruSeen 5.0ですが、TruSeen 5.0＋のGT RunnerかGT3Proなら良いかもしれません。TruSeen 5.0＋へのファームウェアUPDATEを望みたいところです。"
